{
  "api": "arsenal.piano.theory.lexicon/v1",
  "about": "Every word the Nashville row, the chip line, the HUD's plain half and the practice verbs may print (theory-nextgen-spec D10, 2.6; TN0, frozen after TN0, changes go through the conductor). Plain word first, theory name second (dropped first on overflow). Spec 3.2 wins over design-pedagogy 6.2 where they differ: the row says 'new key' (not 'new home') and 'outside <key>' for chromatic chords (not 'far outside'). The canvas draws row words in capitals; stored words are lower case. Scale and key names are addresses, not face words.",
  "guard": {
    "never": [
      "wrong",
      "mistake",
      "error",
      "should",
      "correct",
      "best",
      "score",
      "%",
      "advanced",
      "beginner",
      "despite"
    ],
    "never_symbols": [
      "^",
      "(no3)"
    ],
    "rule": "case-insensitive whole words (and % anywhere) never appear in plain, theory, meaning or caption examples; the symbols never appear either (D12, design-pedagogy 6.1 rule 6). Sources: jam-spec 11.4 and spec 2.6 for the first eight words, design-pedagogy 6.1 rule 3 for the last three."
  },
  "placeholders": [
    "<key>",
    "<old key>",
    "<parallel key>",
    "<target>",
    "<mode>",
    "<interval>",
    "<scale root>",
    "<name>",
    "<note>",
    "<tension>",
    "<quality>",
    "<number>",
    "<count>"
  ],
  "caption_grammar": "<number>   <run> · <run> · <run>. Each run is a lexicon entry's plain or theory part, or a slot. Overflow drops the runs whose role is theory first, then key; plain runs stay. One caption at a time, by priority (D8).",
  "labels": {
    "diatonic": "fn.diatonic",
    "secondary dominant": "fn.secondary_dominant",
    "backdoor": "fn.backdoor",
    "tritone substitute": "fn.tritone_sub",
    "passing diminished": "fn.passing",
    "from the old key": "fn.from_old_key",
    "borrowed": "fn.borrowed",
    "modal colour": "fn.modal",
    "chromatic": "fn.chromatic"
  },
  "captions": [
    {"priority":0,"label":null,"situation":"the rarity banner holds the row (spectacle D8); it carries the number","runs":[],"example":"EPIC · A7♭9 · 3⁷♭⁹"},
    {"priority":1,"label":null,"situation":"tracker switch (D11), 2.4 s; waits at most 4 s behind a banner, else dropped","runs":[{"lex":"row.new_key","part":"plain","role":"plain"},{"slot":"<key>","role":"key"},{"slot":"<interval>","role":"theory"}],"example":"NEW KEY · G MAJOR · DOWN A HALF STEP"},
    {"priority":2,"label":"from the old key","situation":"the pivot rule","runs":[{"lex":"fn.from_old_key","part":"plain","role":"plain"},{"lex":"fn.diatonic","part":"plain","role":"key"}],"example":"♭3⁶ᐟ⁹/5   FROM A♭ MAJOR · IN G MAJOR"},
    {"priority":2,"label":"secondary dominant","situation":"","runs":[{"lex":"fn.secondary_dominant","part":"plain","role":"plain"},{"lex":"fn.secondary_dominant","part":"theory","role":"theory"},{"lex":"fn.diatonic","part":"plain","role":"key"}],"example":"3⁷   PULLS TO 6m · SECONDARY DOMINANT · IN C MAJOR"},
    {"priority":2,"label":"backdoor","situation":"","runs":[{"lex":"fn.backdoor","part":"plain","role":"plain"},{"lex":"fn.backdoor","part":"theory","role":"theory"},{"lex":"fn.diatonic","part":"plain","role":"key"}],"example":"♭7⁷   PULLS HOME · BACKDOOR · IN C MAJOR"},
    {"priority":2,"label":"tritone substitute","situation":"","runs":[{"lex":"fn.tritone_sub","part":"plain","role":"plain"},{"lex":"fn.tritone_sub","part":"theory","role":"theory"},{"lex":"fn.diatonic","part":"plain","role":"key"}],"example":"♭2⁷   SLIDES TO 1 · TRITONE SUB · IN C MAJOR"},
    {"priority":2,"label":"passing diminished","situation":"","runs":[{"lex":"fn.passing","part":"plain","role":"plain"},{"lex":"fn.diatonic","part":"plain","role":"key"}],"example":"♯1°⁷   PASSING · IN C MAJOR"},
    {"priority":2,"label":"borrowed","situation":"","runs":[{"lex":"fn.borrowed","part":"plain","role":"plain"},{"lex":"fn.borrowed","part":"theory","role":"theory"},{"lex":"fn.diatonic","part":"plain","role":"key"}],"example":"4m⁶   BORROWED COLOUR · FROM E♭ MINOR · IN E♭ MAJOR"},
    {"priority":2,"label":"modal colour","situation":"","runs":[{"lex":"fn.modal","part":"plain","role":"plain"},{"lex":"fn.modal","part":"theory","role":"theory"},{"lex":"fn.diatonic","part":"plain","role":"key"}],"example":"♭7   BORROWED COLOUR · MIXOLYDIAN · IN C MAJOR"},
    {"priority":2,"label":"chromatic","situation":"","runs":[{"lex":"fn.chromatic","part":"plain","role":"plain"}],"example":"♭5   OUTSIDE C MAJOR"},
    {"priority":3,"label":"diatonic","situation":"a diatonic colour chord whose scale passes the naming gate, 700 ms after the window settles","runs":[{"lex":"fn.diatonic","part":"plain","role":"key"},{"lex":"scale.caption","part":"plain","role":"theory"}],"example":"4maj13♯11   IN D♭ MAJOR · G♭ LYDIAN"},
    {"priority":4,"label":"diatonic","situation":"otherwise","runs":[{"lex":"fn.diatonic","part":"plain","role":"key"}],"example":"1maj9   IN E♭ MAJOR"},
    {"priority":4,"label":null,"situation":"no key","runs":[{"lex":"row.listening","part":"plain","role":"plain"}],"example":"LISTENING FOR THE KEY"}
  ],
  "entries": [
    {"id":"fn.diatonic","surface":["row","hud","practice"],"plain":"in <key>","theory":"diatonic","meaning":"every note of the chord belongs to the key"},
    {"id":"fn.secondary_dominant","surface":["row","hud","practice"],"plain":"pulls to <target>","theory":"secondary dominant","meaning":"a chord that leans toward a chord other than home"},
    {"id":"fn.backdoor","surface":["row","hud","practice"],"plain":"pulls home","theory":"backdoor","meaning":"the dominant on the flat 7 that steps up to home"},
    {"id":"fn.tritone_sub","surface":["row","hud","practice"],"plain":"slides to <target>","theory":"tritone sub","meaning":"a dominant a half step above the chord it lands on"},
    {"id":"fn.passing","surface":["row","hud","practice"],"plain":"passing","theory":"passing diminished","meaning":"a diminished chord that steps up a half step into the next chord"},
    {"id":"fn.from_old_key","surface":["row","hud","practice"],"plain":"from <old key>","theory":"pivot","meaning":"a chord of the key just left, heard in the new one"},
    {"id":"fn.borrowed","surface":["row","hud","practice"],"plain":"borrowed colour","theory":"from <parallel key>","meaning":"a shade from the other mood of the same home"},
    {"id":"fn.modal","surface":["row","hud","practice"],"plain":"borrowed colour","theory":"<mode>","meaning":"a colour from a mode on the same home"},
    {"id":"fn.chromatic","surface":["row","hud","practice"],"plain":"outside <key>","theory":"chromatic","meaning":"a chord from neither home key"},
    {"id":"row.new_key","surface":["row","practice"],"plain":"new key","theory":"modulation","meaning":"home moves"},
    {"id":"row.listening","surface":["row"],"plain":"listening for the key","theory":"","meaning":"the key is not known yet"},
    {"id":"scale.caption","surface":["row","hud"],"plain":"<scale root> <mode>","theory":"","meaning":"the scale the chord and its colour note share"},
    {"id":"interval.up_half_step","surface":["row","practice"],"plain":"up a half step","theory":"","meaning":"home moved up one half step"},
    {"id":"interval.down_half_step","surface":["row","practice"],"plain":"down a half step","theory":"","meaning":"home moved down one half step"},
    {"id":"interval.up_whole_step","surface":["row","practice"],"plain":"up a whole step","theory":"","meaning":"home moved up two half steps"},
    {"id":"interval.down_whole_step","surface":["row","practice"],"plain":"down a whole step","theory":"","meaning":"home moved down two half steps"},
    {"id":"interval.up_minor_third","surface":["row","practice"],"plain":"up a minor third","theory":"","meaning":"home moved up three half steps"},
    {"id":"interval.down_minor_third","surface":["row","practice"],"plain":"down a minor third","theory":"","meaning":"home moved down three half steps"},
    {"id":"interval.up_major_third","surface":["row","practice"],"plain":"up a major third","theory":"","meaning":"home moved up four half steps"},
    {"id":"interval.down_major_third","surface":["row","practice"],"plain":"down a major third","theory":"","meaning":"home moved down four half steps"},
    {"id":"interval.up_fourth","surface":["row","practice"],"plain":"up a fourth","theory":"","meaning":"home moved up five half steps"},
    {"id":"interval.down_fourth","surface":["row","practice"],"plain":"down a fourth","theory":"","meaning":"home moved down five half steps"},
    {"id":"interval.tritone","surface":["row","practice"],"plain":"a tritone away","theory":"","meaning":"home moved six half steps, halfway round"},
    {"id":"key.relative","surface":["row","practice","study"],"plain":"same notes, other home","theory":"relative key","meaning":"C major and A minor"},
    {"id":"key.parallel","surface":["row","practice","study"],"plain":"same home, other mood","theory":"parallel key","meaning":"E♭ major and E♭ minor"},
    {"id":"chip.no3","surface":["chip","hud"],"plain":"no 3rd","theory":"","meaning":"the chord leaves out its 3rd, so the notes alone do not say major or minor"},
    {"id":"chip.also","surface":["chip","hud"],"plain":"also <name>","theory":"another name for the same notes","meaning":"the name the page gave these notes before; it still fits"},
    {"id":"hud.theory","surface":["hud"],"plain":"theory","theory":"","meaning":"the head of the HUD's theory line"},
    {"id":"hud.clear","surface":["hud"],"plain":"clear","theory":"","meaning":"one name fits these notes well ahead of the next"},
    {"id":"hud.leaning","surface":["hud"],"plain":"leaning","theory":"","meaning":"the first name fits better; the next one is close"},
    {"id":"hud.ambiguous","surface":["hud"],"plain":"ambiguous","theory":"","meaning":"the notes fit more than one name about as well"},
    {"id":"hud.implied","surface":["hud","study"],"plain":"implied","theory":"","meaning":"a scale tone nobody played; the key decides it"},